{"acceptance_criteria":["EXACT_HEAD_REVIEW_PRESERVED","HARD_LIMIT_NOT_WAIVED","NO_MERGE","NO_READY_TRANSITION","NO_W00A2_W00B_W01","NO_SOURCE_ACQUISITION","NO_BENCHMARK_EXECUTION","NO_LUNA","NO_MODEL_WORK","NO_BILLABLE_ACTION","PRIOR_REPAIR02_HANDOFF_33ebbfdc07b8429e6b1f7a19132e118a476f4fb6","PRIOR_REPAIR02_IMPLEMENTATION_0adb60bd8daa307655b20ec87d11f35fa2590ce9","PRIOR_W00_TURN_W00-SOL-20260817T234806Z","PRIOR_W00_IMPLEMENTATION_516254fff643371f4315376a4a2ee0f5aaaaad64","PRIOR_W00_HANDOFF_03e20dfb4692bad3f76710824e7535a4e6a59446","PRIOR_REPAIR01_TURN_W00-SOL-REPAIR01-20260818T021301Z","PRIOR_REPAIR01_IMPLEMENTATION_80e52f0c4f91b3b0dc9314e73e7c270e34475927","PRIOR_REPAIR01_HANDOFF_e5a7fb3ff3c20d7eebdcf73af1ba9c0b18084cab","PRIOR_REPAIR02_TURN_W00-SOL-REPAIR02-20260818T141853Z"],"activation_id":"ACT-W00-REPOSITORY-GOVERNANCE-v3","artifacts":[{"artifact_id":"LOCAL_VALIDATION","kind":"VALIDATION_REPORT","reference":"inline:W00A1_LOCAL_GATE_RECORDS","sha256":"acdca59c40080593d9f6fcf7b3d4c73dfc21be35551af369b5c80a5ae7c36497"},{"artifact_id":"LIVE_READ_ONLY","kind":"LIVE_RECEIPT","reference":"inline:W00A1_LIVE_READ_ONLY_RECORDS","sha256":"5ecd744c21f7f7107bf25f4a78bc9708e60a6009b91baa6ae0c0f5c2fdbd7f71"},{"artifact_id":"INDEPENDENT_REVIEW","kind":"REVIEW_REPORT","reference":"inline:ASSEMBLY_REVIEW_9e721446","sha256":"9de87e078761a8c781b1e472f27a78dcfbf43850f5b8df77d74d83049224cc90"}],"base_sha":"3d3ebb706fe6c8779445cbbfd9fea271b86d3646","billable_actions":{"actual_cost_usd":0,"campaign_ids":[],"performed":false},"branch":"codex/w00-repository-governance","changes":[{"change_id":"W00A1_CUMULATIVE_ADDITIONS","kind":"ADD","summary":"LOCAL_GOVERNANCE_KERNEL_DEFENSE_WORKFLOW_TESTS_AND_STRICT_YAML_PARSER_ADDED","paths":[".github/workflows/governance-integrity.yml","governance/ruff.toml","governance/test_w00_checks.py","governance/w00_checks.py","governance/w00_contracts.py","governance/w00_yaml.rb"]},{"change_id":"W00A1_CUMULATIVE_MODIFICATIONS","kind":"MODIFY","summary":"PACKAGE_CHECKSUM_MANIFEST_AND_HANDOFF_SCHEMA_REPAIRED","paths":["governance/GOV-01-artifacts.sha256","governance/GOV-01-package-manifest.json","governance/schemas/turn-handoff.schema.json"]},{"change_id":"W00A1_REPAIR03_SPEC_RESTORATION","kind":"MODIFY","summary":"REPAIR02_W00B_CLAIMS_RESTORED_TO_APPROVED_W00A1_BOUNDARY","paths":["governance/BRANCH_AND_RULESET_SPEC.md","governance/CHATGPT_REVIEW_SPEC.md","governance/GITHUB_CLI_OPERATION_POLICY.md","governance/GITHUB_OWNER_SETUP.md","governance/OWNER_MERGE_AUTHORIZATION_SPEC.md","governance/REQUIRED_CHECKS_SPEC.md","governance/W00_ACCEPTANCE.md"]},{"change_id":"W00A1_DEFERRED_SCOPE_REMOVAL","kind":"DELETE","summary":"TRUSTED_CANDIDATE_VALIDATOR_RESOURCE_INGESTION_AND_LEGACY_POLICY_RECORD_FIXTURE_ABSTRACTIONS_REMOVED","paths":[".github/workflows/trusted-governance-validator.yml","governance/fixtures/w00-command-policy.json","governance/fixtures/w00-records.json"]}],"codex_run_id":"W00A1_REPAIR03_ROOT","commands":[{"activation_id":"ACT-W00-REPOSITORY-GOVERNANCE-v3","argv":["uv","run","--with","jsonschema==4.25.1","--","python3","-m","unittest","-v","governance/test_w00_checks.py"],"combined_evidence_artifact_sha256":"be6e77418715e6387ed4cef4c826a3102c05f0bd3ee05bd94b6427cda2a66ada","command_evidence_id":"W00A1_REPAIR03_CMD_01","execution_profile":{"actor_login":"abbudjoe","kind":"LOCAL_EXISTING_GH","token_overrides_present":false},"exit_code":0,"finished_at":"2026-08-18T22:31:55.737012Z","implementation_head_sha":"9e72144628880841599d983d6ab9079dfab1a838","result":"PASS","root_turn_id":"W00-SOL-REPAIR03-20260818T230834Z","started_at":"2026-08-18T22:31:53.176904Z","stderr_sha256":"a530c381da600662f1a7b6ba0b68e992dc482cb8ecc1bc685c152e87a8b6fc96","stdout_sha256":"e3b0c44298fc1c149afbf4c8996fb92427ae41e4649b934ca495991b7852b855","working_directory":"/Users/joseph/biblical-scholar-lab"},{"activation_id":"ACT-W00-REPOSITORY-GOVERNANCE-v3","argv":["uv","run","--with","jsonschema==4.25.1","--","python3","-m","py_compile","governance/w00_contracts.py","governance/w00_checks.py"],"combined_evidence_artifact_sha256":"6be7a6150e1b3d0a2ef400c318dc282931396ca90d9694a01315146ca0735a1f","command_evidence_id":"W00A1_REPAIR03_CMD_02","execution_profile":{"actor_login":"abbudjoe","kind":"LOCAL_EXISTING_GH","token_overrides_present":false},"exit_code":0,"finished_at":"2026-08-18T22:31:55.792498Z","implementation_head_sha":"9e72144628880841599d983d6ab9079dfab1a838","result":"PASS","root_turn_id":"W00-SOL-REPAIR03-20260818T230834Z","started_at":"2026-08-18T22:31:55.737085Z","stderr_sha256":"e3b0c44298fc1c149afbf4c8996fb92427ae41e4649b934ca495991b7852b855","stdout_sha256":"e3b0c44298fc1c149afbf4c8996fb92427ae41e4649b934ca495991b7852b855","working_directory":"/Users/joseph/biblical-scholar-lab"},{"activation_id":"ACT-W00-REPOSITORY-GOVERNANCE-v3","argv":["uv","run","--with","jsonschema==4.25.1","--with","coverage==7.10.6","--","python3","-m","coverage","run","--branch","-m","unittest","governance/test_w00_checks.py"],"combined_evidence_artifact_sha256":"64db5db2cdd15979eb9d019585960a701798cb2d398af6738b98fa649bcd110d","command_evidence_id":"W00A1_REPAIR03_CMD_03","execution_profile":{"actor_login":"abbudjoe","kind":"LOCAL_EXISTING_GH","token_overrides_present":false},"exit_code":0,"finished_at":"2026-08-18T22:31:58.675938Z","implementation_head_sha":"9e72144628880841599d983d6ab9079dfab1a838","result":"PASS","root_turn_id":"W00-SOL-REPAIR03-20260818T230834Z","started_at":"2026-08-18T22:31:55.792542Z","stderr_sha256":"380ad24079f3448572622b8cc4fb643c6bb2287078e3b2dae27049fb6855cd5a","stdout_sha256":"e3b0c44298fc1c149afbf4c8996fb92427ae41e4649b934ca495991b7852b855","working_directory":"/Users/joseph/biblical-scholar-lab"},{"activation_id":"ACT-W00-REPOSITORY-GOVERNANCE-v3","argv":["uv","run","--with","jsonschema==4.25.1","--with","coverage==7.10.6","--","python3","-m","coverage","report","--fail-under=90","governance/w00_contracts.py","governance/w00_checks.py"],"combined_evidence_artifact_sha256":"03fe0cc1ad51a2e056fbe5b67397a2ab5e90126871b82cc9c2e35d35a32a6ae5","command_evidence_id":"W00A1_REPAIR03_CMD_04","execution_profile":{"actor_login":"abbudjoe","kind":"LOCAL_EXISTING_GH","token_overrides_present":false},"exit_code":0,"finished_at":"2026-08-18T22:31:58.783360Z","implementation_head_sha":"9e72144628880841599d983d6ab9079dfab1a838","result":"PASS","root_turn_id":"W00-SOL-REPAIR03-20260818T230834Z","started_at":"2026-08-18T22:31:58.675975Z","stderr_sha256":"e3b0c44298fc1c149afbf4c8996fb92427ae41e4649b934ca495991b7852b855","stdout_sha256":"2aca05396b35199fdcf21d3ada482ea812dbc2746a352b07db45b38af1c159f4","working_directory":"/Users/joseph/biblical-scholar-lab"},{"activation_id":"ACT-W00-REPOSITORY-GOVERNANCE-v3","argv":["uvx","ruff@0.16.3","check","--config","governance/ruff.toml","governance/w00_contracts.py","governance/w00_checks.py","governance/test_w00_checks.py"],"combined_evidence_artifact_sha256":"7655685e10abf78ae91d724b17e623b0ce591a88796f884208756eef5d4578bf","command_evidence_id":"W00A1_REPAIR03_CMD_05","execution_profile":{"actor_login":"abbudjoe","kind":"LOCAL_EXISTING_GH","token_overrides_present":false},"exit_code":0,"finished_at":"2026-08-18T22:31:58.820376Z","implementation_head_sha":"9e72144628880841599d983d6ab9079dfab1a838","result":"PASS","root_turn_id":"W00-SOL-REPAIR03-20260818T230834Z","started_at":"2026-08-18T22:31:58.783403Z","stderr_sha256":"e3b0c44298fc1c149afbf4c8996fb92427ae41e4649b934ca495991b7852b855","stdout_sha256":"82b3e6a6c090a57601d22943bd23fca9218d1031dbe5a7b754092f9a156b4f18","working_directory":"/Users/joseph/biblical-scholar-lab"},{"activation_id":"ACT-W00-REPOSITORY-GOVERNANCE-v3","argv":["uvx","ruff@0.16.3","format","--check","--config","governance/ruff.toml","governance/w00_contracts.py","governance/w00_checks.py","governance/test_w00_checks.py"],"combined_evidence_artifact_sha256":"46ab2af4217e88ce9cabf5af5dabd07809dff92584602c24e9280ea0815a0749","command_evidence_id":"W00A1_REPAIR03_CMD_06","execution_profile":{"actor_login":"abbudjoe","kind":"LOCAL_EXISTING_GH","token_overrides_present":false},"exit_code":0,"finished_at":"2026-08-18T22:31:58.855703Z","implementation_head_sha":"9e72144628880841599d983d6ab9079dfab1a838","result":"PASS","root_turn_id":"W00-SOL-REPAIR03-20260818T230834Z","started_at":"2026-08-18T22:31:58.820433Z","stderr_sha256":"e3b0c44298fc1c149afbf4c8996fb92427ae41e4649b934ca495991b7852b855","stdout_sha256":"eee76f865de5a9f2456950f710ae5d5f9b5bd0ea02aa54f614c5eed6642a0bfd","working_directory":"/Users/joseph/biblical-scholar-lab"},{"activation_id":"ACT-W00-REPOSITORY-GOVERNANCE-v3","argv":["uvx","mypy@2.3.1","--strict","--ignore-missing-imports","governance/w00_contracts.py","governance/w00_checks.py"],"combined_evidence_artifact_sha256":"6664047dcdc4bf81838610aa76f33e3a31317cb77ae22f4748da670475933741","command_evidence_id":"W00A1_REPAIR03_CMD_07","execution_profile":{"actor_login":"abbudjoe","kind":"LOCAL_EXISTING_GH","token_overrides_present":false},"exit_code":0,"finished_at":"2026-08-18T22:31:58.943524Z","implementation_head_sha":"9e72144628880841599d983d6ab9079dfab1a838","result":"PASS","root_turn_id":"W00-SOL-REPAIR03-20260818T230834Z","started_at":"2026-08-18T22:31:58.855744Z","stderr_sha256":"e3b0c44298fc1c149afbf4c8996fb92427ae41e4649b934ca495991b7852b855","stdout_sha256":"f9b031e5c45aa702cd4fef028d465551cb20a2c4698e0913c7b00766b20ac4d8","working_directory":"/Users/joseph/biblical-scholar-lab"},{"activation_id":"ACT-W00-REPOSITORY-GOVERNANCE-v3","argv":["uvx","detect-secrets@1.5.0","scan","--all-files"],"combined_evidence_artifact_sha256":"de302d475a2bf96e59cacc34d3c4f2bbd388e4928ff8bd5f86365e90c4eb847b","command_evidence_id":"W00A1_REPAIR03_CMD_08","execution_profile":{"actor_login":"abbudjoe","kind":"LOCAL_EXISTING_GH","token_overrides_present":false},"exit_code":0,"finished_at":"2026-08-18T22:32:00.424250Z","implementation_head_sha":"9e72144628880841599d983d6ab9079dfab1a838","result":"PASS","root_turn_id":"W00-SOL-REPAIR03-20260818T230834Z","started_at":"